,record_no,source,doc_type,question,response,score,cp_score,ragas_score
112,113,msmarco,multi,how many carbs a day should i have,"The number of carbohydrates a person should consume each day depends on their calorie intake, age, and physical activity level. 

For sedentary women between the ages of 19 and 30, a daily calorie intake of 1800-2000 is recommended, with carbohydrates making up 810 to 1300 of those calories. This equates to roughly 202.5 to 325 grams of carbohydrates per day. 

Women who are aged 31 to 50 should consume slightly less, with a recommended daily calorie intake of 1800 and carbohydrate consumption of 202.5 to 292.5 grams. 

If your goal is weight loss, and you aim for a daily calorie intake of 1400, your carbohydrate consumption should be between 630 and 910 calories, which is approximately 157 to 228 grams of carbs. 

It is recommended that carbohydrates make up 45 to 65 percent of your total daily calorie intake, according to the 2010 Dietary Guidelines for Americans. 

As an example, if you consume 1200 calories per day, you should aim for 135 to 195 grams of carbohydrates. If your daily calorie intake is 1600, you should aim for no more than 180 to 260 grams of carbohydrates. 

It's important to note that these are general guidelines, and individual needs may vary. It's always best to consult with a healthcare professional or a registered dietitian to determine the specific carbohydrate and calorie intake that's right for you.",False,1.0,0.6842105263
113,114,msmarco,multi,Nutritional Value of Corn Flakes,"Corn flakes have a high nutritional value and offer various health benefits. Here's a breakdown of their nutritional content: 

- Serving Size: A typical serving size for corn flakes is around 30 grams or 1 cup, which is about 1 ounce in the MyPlate.gov Grains Group. 

- Calories: The calorie count varies slightly depending on the brand and serving size, but generally, 30 grams of corn flakes contain around 110-120 calories. 

- Fat: Corn flakes are often fat-free or very low in fat, with around 0-0.5 grams of fat per serving. 

- Carbohydrates: They are a good source of carbohydrates, providing about 25-26 grams of carbs per 30-gram serving. 

- Protein: The protein content is relatively low, with approximately 1-2 grams of protein per serving. 

- Vitamins and Minerals: Corn flakes are enriched with vitamins and minerals. A 1-cup serving can provide about 30% of your daily recommended iron intake and 15% of your daily vitamin A needs. They also contain thiamin (vitamin B1), which helps produce energy from carbohydrates, and vitamin C, which acts as an antioxidant. 

It's important to note that the nutritional values may vary slightly between different brands and serving sizes, so always check the nutrition label on the product you're consuming for the most accurate information.",True,1.0,0.85
114,115,msmarco,multi,what age can you leave school in qld,"In Queensland, Australia, you can leave school when you turn 16 years old or finish Year 10, whichever comes first. However, it is expected that you will continue your education, whether that be through homeschooling, full-time employment, an apprenticeship, or some other form of training.",False,1.0,0.875
115,116,msmarco,multi,does calcium carbonate have an odor,Calcium carbonate is odourless.,True,1.0,1.0
116,117,msmarco,multi,what does the name vincent mean,"The name Vincent means ""conquering"" or ""to conquer."" It is a boy's name that has English, Latin, and American origins. The name is derived from the Latin name Vincentius and the element 'vincere', which means ""to win.""",True,1.0,1.0
117,118,msmarco,multi,definition of a business association,"A business association is a membership-based organization that promotes the interests of its business members. It is often a nonprofit entity that seeks to advance its members' goals and improve their industry's image. Business associations can be beneficial for small businesses, providing advantages such as access to health insurance through local or regional chambers of commerce. However, it's important to note that not all business associations are equal in terms of their effectiveness or the benefits they offer.",True,1.0,0.9
118,119,msmarco,multi,how long to cook chicken tenderloins in oven,"The cooking time for chicken tenderloins in the oven varies depending on the oven temperature and whether the tenderloins are frozen or thawed. 

For an oven temperature of 375°F, bake frozen tenderloins for 20 to 30 minutes and thawed tenderloins for 15 to 25 minutes. 

At a higher oven temperature of 425°F, the cooking time is shorter. Bake the tenderloins for 8 minutes on each side, for a total of 16 minutes. 

However, some sources suggest a lower oven temperature of 350°F for boneless chicken breasts, cooking for 30 to 35 minutes. 

It is important to ensure that the chicken is fully cooked by checking that the internal temperature reaches 165°F to 170°F, and that the juices run clear when the thickest part of the chicken is pierced.",False,0.2,1.0
119,120,msmarco,multi,what are gallstones,"Gallstones, also known as cholelithiasis, are hardened stones or lumps composed of digestive fluids, cholesterol, salt, bilirubin, or other substances that form in the gallbladder or bile duct. The gallbladder is a small, pear-shaped organ located in the upper right abdomen, just below the liver, that stores bile, a digestive fluid produced by the liver. Gallstones can vary in size and may cause sudden pain if they block the ducts of the biliary tract.",True,1.0,1.0
120,121,msmarco,multi,garage building cost per square foot,"The cost to build a garage ranges from $30 to $100 per square foot, depending on various factors such as labor, materials, and whether you hire a contractor.",True,0.6000000000000001,1.0
121,122,msmarco,multi,what is foodstuffs,"Foodstuffs is a group of two New Zealand grocery and liquor retailers' cooperatives based in the North and South Islands. It controls an estimated 52% of the New Zealand grocery market. The company was founded in 1922 by J. Heaton Barker, who wanted to support independent grocers in Auckland facing competition from chain stores. The original co-operative buying group expanded with the introduction of the Four Square brand in 1925.",True,1.0,1.0
122,123,msmarco,multi,how long to cook a sirloin tip roast per pound,"The cooking time for a sirloin tip roast varies depending on the desired doneness and cooking method. 

For a medium-rare sirloin tip roast, it is recommended to cook it for about 20-25 minutes per pound at an oven temperature of 225 degrees Fahrenheit. 

If you are cooking at a higher temperature of 325 degrees Fahrenheit, the cooking time would be around 25-30 minutes per pound for a medium-cooked roast. 

It is always best to use a meat thermometer to check the doneness of your roast, as the exact cooking time may vary depending on your oven and the shape of the roast. The recommended internal temperature for a medium-rare roast is 140 degrees Fahrenheit, and for a medium roast, it is 145-150 degrees Fahrenheit. 

Remember to always let your roast rest for about 15 minutes after cooking to allow the juices to redistribute and ensure a juicy and evenly cooked roast.",True,1.0,0.6428571429000001
123,124,msmarco,multi,us average salary,"The average salary in the United States varies depending on the source and the specific demographic or geographic group being considered. Here are some figures from the provided context that relate to the average salary in the US:

- According to the US Census Bureau, the average income for persons with doctorates in the US was roughly $81,400, while the average for an advanced degree was $72,824.
- The mean household income in the US, according to the US Census Bureau 2014 Annual Social and Economic Supplement, was $72,641.
- The real median household income in the US averaged $50,781 from 1964-2013.
- The Federal Reserve reported that the real median household income in 2013 was $51,939.
- The Bureau of Labor Statistics reported that the average American worker earned $24.57 per hour or $850.12 per week in December, indicating an annual salary of roughly $44,206.
- The most frequent salary ranges in the US are from $45,000 to $55,000, with 28% of employees earning between $40,000 and $60,000.

It's important to note that these figures may not be directly comparable due to differences in the specific groups or time periods being considered, and some of the information may be outdated. Additionally, average salaries can vary significantly by industry, geographic location, and other factors.",False,1.0,0.6842105263
124,125,msmarco,multi,what is cefdinir prescribed for,"Cefdinir, sold under the brand name Omnicef, is a cephalosporin antibiotic that is prescribed to treat bacterial infections in different parts of the body, including the middle ear, soft tissues, respiratory tract, skin, and sinuses. It is effective against specific types of pneumonia, sinusitis, bronchitis, strep throat, and middle-ear infections. Cefdinir is not effective against viral infections, such as the flu, common cold, or stomach flu.",True,1.0,1.0
125,126,msmarco,multi,what are admission rates out of,"The admission rates vary across different universities and depend on factors such as the number of applicants, changing admissions processes, and the emphasis on out-of-state or international students. Here are some examples of acceptance rates for the fall of 2013 and 2014 from the given context:

- University of Texas at Austin: 40.2% overall acceptance rate for fall 2013
- University of Colorado: 84% acceptance rate, the highest on the New York Times list
- Stanford University: 7.1% acceptance rate
- Yale University: 7.4% acceptance rate (6.72% the previous year)
- Princeton University: 8.4% acceptance rate
- Harvard University: 5.9% acceptance rate (5.8% the previous year)
- Columbia University: 6.94% acceptance rate (6.89% the previous year)
- Brown University: 8.6% acceptance rate (9.2% the previous year)
- Cornell University: 14% acceptance rate (15.2% the previous year)
- University of California: acceptance rates at selective campuses reached new lows, but the overall number of accepted freshmen increased by 4.8% from 2013

These acceptance rates may vary from year to year and are influenced by the number of applicants and other factors considered by the admissions processes of each university.",False,1.0,1.0
126,127,msmarco,multi,anila name meaning,"The name Anila has various meanings depending on the origin and language. In Indian, it means ""children of the wind."" In Sanskrit, it means ""the wind god."" In Sindhi, the name Anila is a girl's name.",True,1.0,0.33333333330000003
127,128,msmarco,multi,what is extracellular fluid called,Extracellular fluid is also called extracellular fluid volume (ECFV) or tissue fluid.,True,0.2,1.0
128,129,msmarco,multi,what is the eye,"The eye is a complex organ that enables us to see. It is not perfectly spherical but rather a fused two-piece unit. The smaller, transparent, and more curved frontal unit is called the cornea, which is linked to the larger, white unit called the sclera. 

Light enters the eye through the cornea, which also begins the process of focusing light rays. Behind the cornea is the lens, which helps to focus light onto the back of the eye. The inside lining of the eye is covered by light-sensing cells called the retina, which converts light into electrical impulses. These impulses are then carried to the brain by the optic nerve. 

The eye also contains a clear, jelly-like substance called the vitreous humor, which makes up about 80% of the eye's volume. The small central area of the retina, called the macula, provides the sharpest vision. 

The eye is a fascinating and intricate organ, allowing us to perceive the world around us through sight.",False,1.0,0.9473684211000001
129,130,msmarco,multi,self transcendence theory definition,"Self-transcendence is a concept in psychology and philosophy that refers to the act or experience of going beyond one's ego or self-concepts and connecting with others and the world on a deeper, more fundamental level. It is associated with spiritual ideas and a sense of unity and harmony with the universe. Self-transcendence involves focusing attention on serving others and improving oneself to fulfill one's potential. It is a key part of psychologist Abraham Maslow's thinking and transpersonal psychology, and it has been incorporated into theories of personality and spiritual care, particularly in aging.",False,1.0,1.0
130,131,msmarco,multi,cost of a hockey stick,"The cost of a hockey stick can vary depending on the type of stick and the quality you are looking for. For a basic wooden stick, you can expect to pay anywhere from $10 to $50. Composite sticks, which are made of more expensive materials, can range from $20 to $500, with most falling between $100 and $400. 

It's important to note that the flex, curve, and design of a hockey stick can also influence the price, and certain brands may offer higher-priced options. Additionally, the length of the stick can also affect the cost, with senior composite sticks typically being longer and costing more. 

If you are just starting out, a wooden stick in the $20-$30 range should be sufficient. For more experienced players or those looking for higher-quality equipment, a composite stick in the $100-$200 range would be a good option.",True,1.0,0.5
131,132,msmarco,multi,how long does the beard have to be on a turkey,"The length of a turkey's beard varies depending on the age and sex of the bird. For male turkeys, or gobblers, the beard typically starts growing when they are about 5 months old and continues to grow throughout their lives. The length of the beard can be used to estimate the age of a gobbler:

- A one-year-old gobbler, or ""jake,"" typically has a beard length of barely visible to a maximum of about 4-5 inches.
- A two-year-old gobbler usually has a beard that is 5 to 7 inches long, and the tips of the filaments will be mostly amber.
- A three-year-old gobbler's beard typically measures 8 inches or more, but due to wear, most 3-year-old and older gobblers have beards that are ""only"" 9 to 10 inches long, with mostly black tips.

It's important to note that there can be exceptions to these estimates, as some factors like habitat and leg length can influence beard length. Additionally, a small percentage of female turkeys, or hens, may also grow beards, typically measuring 6 to 8 inches in length.",False,1.0,1.0
132,133,msmarco,multi,which is a standard theory of how fossil fuels formed,"The most widely accepted theory of how fossil fuels formed is the Biogenic theory, which was first proposed by Mikhail Lomonosov in 1757. This theory suggests that fossil fuels are formed from the remains of dead plants and animals that have been exposed to heat and pressure in the Earth's crust over hundreds of millions of years. The organic material, originally derived from the sun's energy through photosynthesis, is transformed into hydrocarbons that contain energy-rich carbon and hydrogen bonds. This process results in the formation of coal, oil, and natural gas, which are the primary fossil fuels used today.",False,1.0,1.0
133,134,msmarco,multi,what cultural difference between micronesia polynesia and melanesia,"Melanesia, Micronesia, and Polynesia are three distinct cultural areas in the Pacific Ocean, each with its own unique characteristics and history. Here are the cultural differences between them:

**Melanesia:**
- Inhabited by Melanesian people who are genetically related to Negroid and Australian Aboriginal groups.
- Melanesian people typically have dark skin and afro-textured hair.
- Located mostly below the equator in the southwestern Pacific, including islands such as New Guinea.
- The area consists of thousands of islands with a diverse range of cultures, art forms, and religions.

**Micronesia:**
- Inhabited by people who are genetically distinct from Melanesians and are thought to originate from the Indonesian area.
- Located above the equator and consists of small groups of islands, including the Marshall Islands, Marianas Islands, Palau, and the Federated States of Micronesia.
- Includes low-lying coral atolls and covers a total land area of approximately 2,700 square kilometers.

**Polynesia:**
- Inhabited by people who are genetically distinct from both Melanesians and Micronesians, with origins tracing back to the original tribes of Taiwan.
- Polynesia covers a large and diverse geographical area, including all island types such as continental and volcanic islands.
- Polynesians are generally lighter-skinned compared to Melanesians.
- Located within a triangle formed by Hawaii, Easter Island, and New Zealand, and includes other islands such as Tonga, Samoa, Cook Islands, French Polynesia, and Tahiti.

In summary, the cultural differences between these three areas lie in their distinct genetic origins, physical characteristics, geographical locations, and unique cultural practices.",False,0.8,0.8666666667
134,135,msmarco,multi,what structure in the knee prevents hyperextension,"The tendons and ligaments in the knee prevent hyperextension. Specifically, the hamstring tendons, gastrocnemius tendons, and the posterior cruciate ligament (PCL) work together to prevent the knee from hyperextending. The PCL also works with the anterior cruciate ligament (ACL) to control the passive 'screw home' mechanism of the knee in terminal knee extension. Additionally, the patellar ligament holds the patella in place on the anterior surface of the knee.",False,0.4,0.8888888889000001
135,136,msmarco,multi,what is meant by genetic mutation,"A genetic mutation refers to a permanent alteration in the DNA sequence of a gene or chromosome. It represents a change in the genetic composition of a cell, specifically in the nucleic acid sequence of the genotype of an organism. These mutations can occur due to damage to DNA that is not repaired, errors during DNA replication, or the insertion/deletion of DNA segments by mobile genetic elements. The effects of genetic mutations can vary, ranging from no observable impact to significant changes in an organism's characteristics or functionality of certain genes.",True,1.0,1.0
136,137,msmarco,multi,does glucosamine cause gout,"No, taking glucosamine is not likely to cause gout or have any effect on it. Gout is a form of arthritis caused by the buildup of uric acid crystals in the joints, leading to sudden and severe attacks of pain, redness, and tenderness. While glucosamine is often used to treat arthritis and joint degeneration, its link to gout is through its potential ability to reduce inflammation and pain associated with the condition. However, it is important to note that gout is typically treated with medication, sometimes including glucosamine and chondroitin sulfate, to manage symptoms and reduce uric acid levels.",True,1.0,0.8
137,138,msmarco,multi,are oxygen tanks pressurized tanks,"Yes, oxygen tanks are pressurized tanks that hold oxygen or liquid oxygen. The oxygen is stored under pressure in gas cylinders or as liquid oxygen in a cryogenic storage tank.",False,1.0,1.0
138,139,msmarco,multi,what occurs in the synapse between neurons,"A synapse is a junction or gap between two neurons, or between a neuron and an effector organ, that allows the transmission of neural impulses or signals. These signals can be electrical or chemical. 

In a chemical synapse, neurotransmitter molecules are released from the presynaptic neuron into the synaptic cleft—the small space between the two neurons. These molecules then bind to receptor sites on the postsynaptic neuron, triggering an electrical signal in that neuron. 

Synapses are essential for neural communication and allow neurons to form circuits within the central nervous system. They can occur between various parts of neurons, such as between an axon and a dendrite (axo-dendritic synapse) or between axon terminals (axo-axonic synapse). Astrocytes, which are non-neuronal cells, also play a role in synaptic function by exchanging information with the neurons and regulating neurotransmission.",False,1.0,0.8333333333
139,140,msmarco,multi,cost to add commercial walls,"The cost of adding commercial walls can vary depending on the materials used, labor rates, and the complexity of the project. 

For a basic partition wall with one side drywalled and finished, the cost is approximately $4 per square foot. This includes framing and drywall, but not texture. 

Building walls with Insulated Concrete Forms (ICFs) can add $1 to $4 per square foot to the construction cost, but ICF buildings are more energy-efficient, which can result in savings on heating and cooling equipment. 

Other factors that can influence the cost include the need for electrical or HVAC work, as well as the regional labor rates for carpenters, electricians, and painters. 

It is always recommended to get multiple quotes from contractors and to consult with an engineer for projects that require structural integrity, such as retaining walls over 3 feet high.",True,1.0,0.8823529412000001
140,141,msmarco,multi,do you dry your cold sore out or keep it moist,"There is conflicting advice on whether to dry out or keep a cold sore moist. Some sources suggest that drying out the sore involves applying an astringent, while others recommend keeping it moist with cream or oil to possibly reduce inflammation and prevent bacterial infections. It is also suggested that keeping the sore moist may deprive it of oxygen, which could help in treatment. Ultimately, it may be a matter of personal preference and effectiveness for the individual.",True,1.0,0.6000000000000001
141,142,msmarco,multi,what does xenon mean,"Xenon has a few different meanings depending on the context. 

In chemistry, xenon is a rare, colorless, odorless, and inert gaseous element that occurs in trace amounts in the Earth's atmosphere and is used in specialized lighting and scientific research. It is a noble gas and has the atomic number 54. 

In Greek, Xenon is a boy's name meaning ""stranger."" 

In automotive technology, xenon is used in headlights, known as bi-xenon headlights, which provide a strong light output for both low and high beams. 

Is there anything else you would like to know or clarify about the word ""xenon""?",True,1.0,1.0
142,143,msmarco,multi,what is genu varum,"Genu varum, also known as bow-leggedness, is a physical deformity characterized by the outward bowing of the legs at the knee. It is caused by defective growth on the medial side of the epiphyseal plate, which can be the result of various conditions that affect bone formation, such as rickets. This disorder is noticeable when a person is standing with their feet together but has a noticeable gap between their knee joints.",True,1.0,0.875
143,144,msmarco,multi,average temperature in palm springs in february,The average temperature in Palm Springs in February is around 67 degrees Fahrenheit (or 19 degrees Celsius).,True,1.0,0.5
144,145,msmarco,multi,where is volcano california located,"Volcano, California, is located in Amador County, in the northern part of the state. It lies at an elevation of 2070 feet (631 m) and has a population of 115 people as of the 2010 census. The primary coordinate point for Volcano is 38.4456 degrees north latitude and -120.6305 degrees west longitude.",True,1.0,0.8333333333
145,146,msmarco,multi,what is rqwl in rajdhani,"RQWL stands for Remote Quota Waiting List. It is a type of waiting list used for intermediate stations on the train route. The first half of the status, RQWL, indicates your booking status, while the second half indicates your current status, which can change depending on cancellations of previously confirmed tickets.",True,0.8,1.0
146,147,msmarco,multi,interest subsidy means in educational loan,"Interest subsidy in the context of educational loans refers to when the government or a specified entity pays the interest accrued on a loan taken out by a student, typically during periods when the student is enrolled in school or in a defined grace period after graduation. This effectively gives the loan a zero percent interest rate during these specified periods, reducing the overall financial burden on the borrower.",False,1.0,0.8
147,148,msmarco,multi,python how to append to a list,"To append an element to a list in Python, you can use the append method. The append method allows you to add a single item to the end of an existing list. Here's an example code snippet:

my_list = [1, 2, 3]
my_list.append(4)
print(my_list) # Output: [1, 2, 3, 4]

In this example, we have a list my_list with initial elements [1, 2, 3]. We then use the append method to add the element 4 to the end of the list. After appending, the updated list becomes [1, 2, 3, 4].

You can also use the extend method if you want to add multiple elements or another list to the end of an existing list. Here's an example:

my_list = [1, 2, 3]
my_list.extend([4, 5, 6])
print(my_list) # Output: [1, 2, 3, 4, 5, 6]

In this example, we extend my_list with the elements [4, 5, 6], resulting in the updated list [1, 2, 3, 4, 5, 6].",True,1.0,0.375
