,record_no,source,doc_type,question,response,score,cp_score,ragas_score
40,41,msmarco,multi,what is a transgenic organism and give an example,"A transgenic organism is a type of genetically modified organism (GMO) that has had its genetic material altered by genetic engineering techniques. This often involves inserting DNA from another species into the organism's embryo, creating an organism with a unique combination of genetic material from multiple sources. 

An example of a transgenic organism is a plant that has been engineered to have increased resistance to frost. By introducing a gene from an organism that naturally tolerates cold temperatures, scientists can create a transgenic plant that can survive in colder climates. This could potentially expand the geographical range of certain crops and improve agricultural productivity.",False,1.0,0.4444444444
41,42,msmarco,multi,how can you measure effectiveness,"There are several ways to measure effectiveness depending on the context. 

In a business or marketing context, effectiveness can be measured through key performance indicators (KPIs) such as customer lifetime value (CLV), return on investment (ROI), number and value of leads generated, revenue driven by marketing, coverage (number of customers served), backlog, and customer satisfaction. These metrics provide insights into the performance and impact of marketing activities. 

For management effectiveness, indicators may include the ability to network and manage client relationships, meet communication, training, and safety needs of employees, revenue generation, and the market value of a publicly traded company's stock over time. 

In a more general sense, effectiveness can be measured by evaluating the achievement of objectives and expectations. This can apply to various domains, including project development, strategy implementation, or service provision. 

It is important to define the specific context and objectives when determining the most relevant and effective metrics to use.",False,1.0,0.8888888889000001
42,43,msmarco,multi,george westinghouse what did he invent,"George Westinghouse invented the air brake, also known as the ""Railway Air Brake,"" which revolutionized the railroad industry by making braking safer and allowing trains to travel faster. He also patented several other devices related to railroads and made contributions to the field of electricity, though he is primarily known for his work with railway equipment. Westinghouse started the Westinghouse Electric & Manufacturing Company to improve AC power generators.",True,1.0,1.0
43,44,msmarco,multi,loan origination fee deductible,"Loan origination fees are tax-deductible if they are clearly stated as points on top of the GFE and do not pay for other items. Additionally, the cash you contribute to the loan must be greater than the amount paid in origination points, and the loan must be for a primary residence. 

It's important to note that there are two types of loan origination fees: deductible and non-deductible. Deductible fees, also known as maximum loan charges or discount points, represent prepaid interest and can be deducted over the life of the loan if you cannot deduct them immediately. Non-deductible fees include closing costs such as appraisal fees, title fees, legal expenses, and prepaid property taxes.

When taking out a loan, it is essential to review the settlement statement carefully to identify the prepaid interest and sort out the deductible and non-deductible fees.",True,1.0,1.0
44,45,msmarco,multi,why beta carotene supplements is good for you,"Beta-carotene supplements are often touted as a way to boost overall health and prevent disease. Here are some reasons why beta-carotene supplements are considered beneficial: 

- Antioxidant Properties: Beta-carotene is a powerful antioxidant that helps protect the body from damage caused by free radicals. Free radicals are unstable molecules that can contribute to chronic illnesses over time. By inhibiting the oxidation of other molecules, beta-carotene acts as a guardian of cellular health. 

- Vitamin A Conversion: Beta-carotene is a precursor to vitamin A (retinol). This means that when you consume beta-carotene, your body converts it into vitamin A as needed. Vitamin A is essential for various functions in the body, including maintaining healthy skin, promoting good vision and eye health, boosting the immune system, and supporting cell division and reproduction. 

- Disease Prevention: Some studies suggest that beta-carotene may help lower the risk of certain conditions, including cancer and heart disease. This is likely due to its antioxidant and anti-inflammatory properties, which can help reduce cellular damage and maintain overall health. 

- Improved Nutrient Intake: For individuals who may not get enough beta-carotene or vitamin A from their regular diet, supplements can help bridge the gap. This is especially beneficial for those who do not regularly consume the recommended amount of fruits and vegetables that are rich in beta-carotene. 

- Anti-Aging Benefits: Beta-carotene is often classified as an anti-aging micronutrient due to its ability to reduce illness, improve overall health, and potentially increase longevity. Its role in maintaining healthy skin, eyes, and immune function contributes to overall well-being as we age. 

While beta-carotene supplements can provide these potential benefits, it is always important to consult with a healthcare professional before adding any supplement to your routine. Additionally, consuming beta-carotene through a balanced diet that includes colorful fruits and vegetables is generally considered the safest and most beneficial approach.",True,0.4,0.7037037037
45,46,msmarco,multi,what is behcet's disease,"Behçet's disease, also known as Behçet's syndrome, is a rare, chronic, autoinflammatory disorder of unknown origin. It is characterized by vasculitis, which is inflammation of the blood vessels, resulting in damage to both arteries and veins anywhere in the body. This inflammation causes various symptoms in different parts of the body, including sores in the mouth and on the genitals, as well as more serious eye issues such as inflammation, swelling, redness, heat, and pain. Some people may inherit a predisposition to the disease or have a problem with their immune system that makes them more likely to develop it.",True,1.0,1.0
46,47,msmarco,multi,the meaning of name halen,"The name Halen has multiple meanings depending on the origin. In Old English, it means ""hollow,"" and in Greek, it means ""shining light"" or ""sun ray.""",True,0.0,0.0
47,48,msmarco,multi,how much to raise a child,"The cost of raising a child varies depending on geographic location and the family's income. According to the US Department of Agriculture's annual Cost of Raising a Child report, a middle-income family in the US can expect to spend approximately $245,340 (or $304,480, adjusted for projected inflation) to raise a child born in 2013 up until the age of 18. This equates to roughly $12,800 - $14,970 per child per year for a two-parent family with a median annual income between $61,530 and $106,540.

It's important to note that this cost can vary widely. For example, the report found that the highest costs were in the urban Northeast, with an estimated cost of $282,480 per child, while the lowest costs were in the urban South at $230,610. Child care costs have also soared and can be a significant burden for families.",False,1.0,1.0
48,49,msmarco,multi,what is speed training definition,"Speed training is a type of physical training that involves improving an athlete's maximum speed, acceleration, and speed endurance. It is an important aspect of fitness for success in many sports, especially for athletes in events or activities that require quick movements and bursts of speed, such as sprinting, swimming, cycling, and speed skating. 

Speed training can include various methods such as interval training, which involves a series of low- to high-intensity exercises with rest periods in between. A specific speed training method is described in the context, suggesting the use of a hill with a maximum 15° decline to build up to full speed and then maintain it for a certain distance. 

The definition of speed itself is the distance covered divided by the time it takes to cover that distance, and speed training aims to improve an athlete's ability to maximize this ratio.",False,0.4,1.0
49,50,msmarco,multi,diode is used for,"A diode is a fundamental component in electronics, primarily used to control the direction of current flow in a circuit. It allows current to pass through it in one direction (from the anode to the cathode) with low resistance, while blocking current flow in the opposite direction with very high resistance. This unidirectional behavior makes diodes ideal for several applications, including:
1. Rectification: Diodes can convert alternating current (AC) to direct current (DC) through a process called rectification. A diode bridge is a common configuration used for this purpose in power supplies.
2. Voltage Regulation: Zener diodes are specifically designed to maintain a constant voltage across a circuit, even when the input voltage varies. This property makes them useful for voltage regulation and reference in power supplies.
3. Switching: Switching diodes are used to turn circuits on or off. Band switching diodes are specialized for switching high-frequency signals.
4. Signal Processing: Diodes can be used for various signal processing functions, including limiting, modulation, mixing, demodulation, and oscillation.
5. Light Emission: Light-emitting diodes (LEDs) produce light when a current passes through them and are used in a wide range of applications, from indicators to general lighting.
6. Logic Gates: Diodes can be used to create logic gates, which are fundamental building blocks of digital circuits and computer systems.
7. Clamps and Voltage Limiters: Diodes can be employed as clamps or voltage limiters to protect circuits from voltage spikes or to limit voltage levels.

In summary, diodes are versatile components that enable the control and manipulation of current flow, making them essential in a wide range of electronic applications.",True,1.0,0.84
50,51,msmarco,multi,how long do Shelties live?,"Shelties, or Shetland Sheepdogs, typically have a lifespan of between 11 and 15 years with proper care. On average, they live between 12 and 14 years.",True,1.0,1.0
51,52,msmarco,multi,bad food for ldl cholesterol,"Foods that are bad for LDL cholesterol and should be avoided include:
- Foods rich in trans fats: shortening, margarine, cake and biscuit mixes, ramen noodles, deep-fried fast food, frozen foods, doughnuts, baked goods, candy, crackers, chips, breakfast cereal, energy bars, dips, gravy mixes, toppings, and eggs (especially the yolk)
- Foods high in saturated fats: these can include fatty meats, full-fat dairy products, and processed foods.

It is important to note that while eggs are generally healthy, if you have high cholesterol, it is best to avoid the yolk and only consume the egg whites.",True,1.0,0.5
52,53,msmarco,multi,name meanings aphrodite,"Aphrodite is a Greek name that means ""foam,"" which refers to the sea foam or semen that the goddess of love, beauty, and procreation is said to have emerged from in her origin story.",True,1.0,1.0
53,54,msmarco,multi,is cyprus safe,"Cyprus is generally considered a safe place to visit, with a low rate of violent crime. However, it is always important to remain vigilant and cautious, especially when it comes to accepting drinks from strangers, as muggings have been reported in certain areas. There have been reports of ISIS mobilizing in the region, but the Cypriot government and international authorities are actively working to address security concerns. It's always a good idea to stay informed about the latest travel advisories and safety updates before visiting any foreign country.",True,0.8,0.6000000000000001
54,55,msmarco,multi,food groups definition,"A food group is a collection of foods that share similar nutritional properties or biological classifications. Nutrition guides typically divide foods into food groups and recommend a certain daily intake from each group to ensure a healthy diet. 

The number of food groups varies depending on the specific nutrition guide being referenced. For example, the US Department of Agriculture (USDA) has described food groups ranging from 4 to 11, while some sources simplify this into three basic groups: grow foods (body-building foods), go foods (energy-giving foods), and glow foods (body-regulating foods). 

Here is a list of some common food groups: 
- Dairy: milk, yogurt, cheese, and milk-based desserts like ice cream and pudding.
- Fruits: fresh, dried, frozen, canned fruits, and 100% fruit juice.
- Vegetables: a diverse group of foods that includes many different shapes, colors, and sizes.
- Carbohydrates: bread, cereals, rice, oats, and pasta.
- Citrus Fruits: grapefruits, lemons, melon, oranges, papaya, strawberries, and tomatoes.
- Meat/Nuts/Legumes: meat, seafood, nuts, and legumes.
- Breads/Cereals: rice, corn, bread, oatmeal, macaroni, and noodles.
- Fats: oils, sweets, chocolate, and other foods that don't fall into the basic food groups. 

It is important to note that the specific composition of food groups can vary slightly between different nutritional systems and guidelines.",True,0.8,1.0
55,56,msmarco,multi,how do i know if my child has diabetes signs,"Here are some signs that may indicate your child has type 1 diabetes: 

- Increased thirst and frequent urination: This is a common early sign of diabetes as the body tries to get rid of the excess glucose in the blood by producing more urine, leading to increased thirst. 
- Extreme hunger: The body is unable to use glucose for energy effectively, so it tries to compensate by making you feel hungry, encouraging you to eat more glucose-providing food. 
- Weight loss: Despite extreme hunger and potentially eating more, weight loss can occur due to the body's inability to use glucose effectively for energy. 
- Blurred vision: High blood glucose levels can affect the shape of the lens in the eye, causing changes in vision. 
- Fatigue: Again, this is due to the body's inability to use glucose effectively for energy, leading to a lack of energy and potential tiredness or fatigue. 

If you notice any of these signs, it is important to make an appointment with your doctor, who can check your child's blood glucose levels and make a diagnosis. Early detection of diabetes is crucial to preventing potentially fatal complications.",True,1.0,0.4285714286
56,57,msmarco,multi,marginal cost of equity,"The marginal cost of equity is calculated by adding the expected dividend growth rate to the ratio of the following year's dividend payments to the stock price, taking into account stock issuance costs.",True,1.0,1.0
57,58,msmarco,multi,what is medium trot,"A medium trot is a variation of the horse gait, or pace, of a trot. It is characterized by some lengthening of the stride while maintaining a rounded frame and slightly lower head position from the horse when compared to a working trot. It is faster than a collected trot but slower than an extended trot.",True,1.0,0.7142857143
58,59,msmarco,multi,what does a rumen do,"The rumen is the largest compartment of a cow's four-chambered stomach, serving as a large fermentation vat. It is responsible for breaking down ingested feed, especially cellulose, with the help of billions of symbiotic microorganisms, including bacteria, protozoa, and other microbes. These microbes aid in the digestion of fiber, cellulose, and hemicellulose, converting them into usable energy for the cow, such as volatile fatty acids. The rumen can hold a large capacity of up to 49-50 gallons in adult dairy cows and even more in larger cattle breeds.",True,1.0,1.0
59,60,msmarco,multi,how are irs penalties calculated,"IRS penalties for late tax payments or filings are calculated based on the amount of tax owed, the lateness, and the total unpaid amount. 

If you fail to pay your taxes on time, the IRS will charge a penalty of 0.5% of the overdue amount each month, up to a maximum of 25%. 

For late filings, the penalty is 5% of the additional taxes owed for each month your return is late, also up to a maximum of 25%. If your return is over 60 days late, there is a minimum penalty of either $135 or 100% of your unpaid tax, whichever is smaller. 

Interest is also charged on the unpaid amount, currently set at 3% per year and calculated daily. 

The IRS treats each case individually and will send a separate bill for penalties and interest after receiving or accepting your return.",True,1.0,0.9375
60,61,msmarco,multi,what does manager mean,"A manager is a person responsible for planning, organizing, and directing the work of a group of individuals, typically in a business, restaurant, or sports team setting. They are in charge of a specific group of tasks or a subset of a company and are responsible for accomplishing the goals set for that area. Managers often have a staff that reports to them and may take corrective action when necessary. The specific responsibilities of a manager can vary depending on the organization and its needs.",True,1.0,0.7692307692
61,62,msmarco,multi,how long will deli meat keep in the fridge,"Deli meat will keep in the fridge for about 3 to 5 days if it has been handled and stored properly. To maximize the shelf life of deli meat, it should be stored in an airtight container in the refrigerator. If you need to keep it for a longer period, you can transfer it to the freezer.",True,1.0,1.0
62,63,msmarco,multi,what was the purpose of the stanford prison experiment,The purpose of the Stanford Prison Experiment was to investigate the psychological effects of becoming a prisoner or prison guard and to understand the dynamics between the two roles. The experiment aimed to determine whether the brutality reported among guards in American prisons was due to the guards' inherent sadistic personalities or if it was influenced more by the prison environment.,True,1.0,1.0
63,64,msmarco,multi,how to minimize moving costs,"There are several strategies you can use to minimize moving costs. Here are some tips:

- Time your move: Schedule your move during the middle of the month, as movers are typically busiest at the beginning and end of the month when leases turn over.
- Pack your own boxes: By packing your belongings yourself, you can reduce the amount of work required by the moving company and lower your overall moving costs.
- Get rid of old belongings: Downsizing and getting rid of items you no longer use can reduce the weight of your load and lower moving expenses. You can even sell valuable items to make some extra money for your moving budget.
- Save on boxes: Instead of buying new boxes, look for used or recycled boxes to pack your items. You can often find free boxes online through sites like Craigslist or local classifieds.
- Compare quotes: Get multiple quotes from different moving companies to find the best price. This will help you avoid overpaying and make an informed decision about which company to choose.
- Collect packing materials: Start collecting packing materials like boxes, tape, and bubble wrap in advance. This will ensure you have enough when it's time to pack and can avoid last-minute purchases.
- Hire an efficient moving company: Look for a moving company with a reputation for being quick and efficient. A efficient firm will take steps to make the moving process smoother and more cost-effective.
- Claim freebies: Keep an eye out for free moving supplies from work, friends, or online groups. Every little bit helps when it comes to saving on moving costs!

By following these tips and planning ahead, you can significantly minimize your moving costs and make your relocation more affordable.",False,1.0,0.9583333333
64,65,msmarco,multi,what age does cvs hire,"The minimum age to work at CVS is 16 years old for positions such as cashier, sales associate, and beauty care associate. However, some positions have different age requirements, such as 18 years old to work in the pharmacy or photo department, and 21 years old to work in the liquor store.",True,0.4,0.8
65,66,msmarco,multi,when i sprint why do i get a burning and sting sensation in my stomach,"There could be several reasons why you experience a burning and stinging sensation in your stomach when you sprint. Here are some possible explanations based on the provided context:

- **Gastritis**: Gastritis is a condition where the lining of the stomach becomes irritated, damaged, or inflamed. Sprinting can increase gastric juices, which, when coming into contact with the inflamed lining, can cause a burning sensation.
- **GERD (Gastroesophageal Reflux Disease)**: GERD is a digestive disorder where stomach acids back up into the esophagus. Sprinting can increase abdominal pressure, causing acid reflux and a burning feeling.
- **Food allergies or intolerances**: Sprinting can lead to a faster ingestion of food and a quicker emptying of the stomach, potentially triggering an allergic or intolerant reaction and resulting in a burning sensation.
- **Emotional stress**: Stress can affect digestion and stomach sensitivity. The adrenaline and increased stomach acid production during sprinting, coupled with emotional stress, might contribute to the burning and stinging sensation.
- **Stomach ulcer**: Ulcers are sores in the lining of the stomach, which can be aggravated by stomach acids. The physical exertion of sprinting could stimulate acid secretion and intensify the pain.

It is important to consult a medical professional to determine the exact cause of your burning and stinging sensation, as they can provide a personalized assessment based on your medical history and symptoms.",True,0.8,0.3888888889
66,67,msmarco,multi,what is printmaking art,"Printmaking is an art form in which ink or other materials are transferred from a matrix (such as a block, plate, or screen) to a material like paper, fabric, wood, or stone. It is considered an original art form because it is done by hand, and each printmaking process lends itself to unique qualities. Printmaking allows artists to create ""multiple originals"" of an artwork, meaning that each print is an original rather than a simple reproduction. There are various techniques used in printmaking, and artists choose their medium based on the effect they want to achieve.",True,1.0,1.0
67,68,msmarco,multi,what does the name kiana mean,"The name Kiana has various meanings depending on its origin and cultural context. Here are some of the commonly accepted meanings:

- Hawaiian Origin: In Hawaii, Kiana is considered a form of the name Diana, derived from an old Indo-European root meaning ""heavenly"" or ""divine."" It is associated with the Roman goddess of the moon, hunting, forests, and childbirth, as well as the Greek goddess Artemis. Alternatively, it can mean ""moon goddess,"" ""beautiful and angelic flower,"" or ""calm water.""
- Irish and American Origin: In Irish and American cultures, Kiana is often interpreted as meaning ""ancient.""
- Korean and Spanish Combination: For someone with a Korean and Spanish background, like your friend Kiana, the name can be seen as a combination of the Korean name ""Ki,"" meaning ""arisen,"" and the Spanish name ""Ana,"" meaning ""princess."" So together, it can mean ""arisen princess.""
- Grace: In some sources, the name Kiana is associated with the meaning ""grace.""

It's worth noting that name meanings can vary across different sources and interpretations, and some of these meanings may be more widely accepted than others.",False,1.0,0.8888888889000001
68,69,msmarco,multi,why is the black sea called black,"There are several theories as to why the Black Sea is called as such. One theory suggests that the name originates from the Medieval Turkish word 'Kara', which means 'North'. Another theory suggests that the sea appears black due to the lack of oxygen in the water, which prevents the development of microorganisms. Additionally, the intense fogs that develop over the Black Sea can also absorb light, making the water appear darker. The Black Sea has also been historically known as a 'Sea of Death' due to the dangerous storms that sailors would often encounter, further contributing to its ominous name.",True,1.0,1.0
69,70,msmarco,multi,how to make oven roasted potatoes,"Here is a general guide on how to make oven-roasted potatoes:

1. Preheat your oven to a temperature between 350-475°F, depending on your recipe and desired cooking time.
2. Cut your potatoes into halves, quarters, or uniform sizes.
3. In a large bowl, toss the potatoes with oil, salt, pepper, and any desired herbs or spices (such as garlic, rosemary, thyme, or red pepper flakes).
4. Spread the potatoes in a single layer on a roasting pan or baking sheet.
5. Roast in the oven for 20-45 minutes, depending on the size of your potatoes and the desired level of doneness. Stir or flip the potatoes occasionally to ensure even browning on all sides.
6. Remove from the oven, season to taste, and serve hot.

Feel free to experiment with different herb and spice combinations to find your favorite roasted potato flavor!",True,1.0,0.9166666667000001
