,record_no,source,doc_type,question,response,score,cp_score,ragas_score
0,1,msmarco,multi,what kind of benefit is fsa considered,"A flexible spending account (FSA) is considered a tax-advantaged benefit, allowing users to set aside pre-tax income for qualified expenses, primarily medical and dependent care expenses. This benefit is offered through employer-sponsored plans, often as part of a cafeteria plan, providing employees with flexibility in allocating their earnings towards eligible out-of-pocket costs.",True,1.0,1.0
1,2,msmarco,multi,why does adaptation occur,"Adaptation occurs as a result of natural selection, where environmental changes favor individuals with certain traits, allowing them to survive and reproduce successfully. This leads to the accumulation of beneficial traits in subsequent generations, making the population better suited to their environment over time. Adaptation ensures organisms can eat, survive, and thrive in their specific habitats.",True,1.0,1.0
2,3,msmarco,multi,what type of energy is a tesla coil,"A Tesla coil produces high-voltage, low-current, high-frequency alternating current electricity.",True,1.0,1.0
3,4,msmarco,multi,where is el salvador,"El Salvador is a country in Central America, bordered on the southwest by the Pacific Ocean. It is located between Guatemala to the west and Honduras to the north and east. As the smallest country in Central America, it has a total area of 21,041 square kilometers (8,124.59 square miles).",True,1.0,1.0
4,5,msmarco,multi,how do you test for hiv,"There are several ways to get tested for HIV:
- Ask your doctor to perform an HIV test.
- Visit a local HIV testing site, which can be found through the National HIV and STD Resources website.
- Use a home test kit, such as the Home Access Test, where you collect a blood sample at home and mail it to a lab for testing.
- Rapid HIV tests are also available, where a clinic staff member will prick your finger to collect a few drops of blood, and you can receive results in less than 30 minutes.
- The OraSure test is used at many testing sites, where a probe is placed in your mouth between your cheek and gums for about 4 minutes.

It is important to note that the window period for HIV testing, or the time it takes for antibodies to be detectable, is typically between 2 and 12 weeks after exposure. If you have been potentially exposed to HIV, it is recommended to get tested again at the 3-month mark to be confident of your status.",True,1.0,1.0
5,6,msmarco,multi,what does testosterone free mean,"Testosterone free refers to the amount of testosterone in the blood that is not bound to a protein called sex hormone binding globulin (SHBG). Most of the testosterone in the blood is typically bound to SHBG, but a small portion is unattached or ""free."" This free testosterone is biologically active and can affect sexual traits and drive in both men and women.",True,1.0,0.8
6,7,msmarco,multi,do palestinians have the vote,"No, many Palestinians do not have voting rights. In the context of Israel and Palestine, there are three types of Palestinians, and only one group has Israeli citizenship and voting rights. Even with this group, they make up a small minority of the voting population and have limited political representation. 

The situation is further complicated by the division of Palestinian leadership between the Palestinian Authority (PA) and Hamas, which govern the West Bank and Gaza Strip, respectively. While the PA has limited autonomy and participates in diplomatic efforts, Hamas is considered a terrorist organization by many countries and does not engage in the same way with the international community. 

The lack of voting rights for Palestinians has been a longstanding issue and a point of contention in the Israeli-Palestinian conflict. It is often seen as a symptom of the broader power dynamics and inequalities between Israelis and Palestinians.",True,1.0,0.375
7,8,msmarco,multi,what kind of permit is a pool permit,"A pool permit is a combination permit that covers the construction of a swimming pool as well as the electrical, plumbing, and mechanical work directly related to the pool's construction. This type of permit is required for any private swimming pool, which is defined as a pool built on the grounds of a single-family residence and used solely by the owner, immediate family, tenants, and guests. It is important to note that additional permits, such as a sediment control permit, may also be necessary depending on the scale of the project.",True,0.8,0.9
8,9,msmarco,multi,what does the disaster relief team provide,"Disaster relief teams provide a range of services and support to communities affected by disasters, such as hurricanes, earthquakes, and hurricanes. These teams offer immediate assistance and help lay the foundation for long-term recovery and rehabilitation.

For example, the Office of U.S. Foreign Disaster Assistance (OFDA) supports programs that help people get back to their former jobs, provide psychosocial care to traumatized survivors, and empower individuals to rebuild their lives. 

The Red Cross, while not a government agency, is also a crucial part of disaster relief, partnering with other organizations to provide various services to disaster victims. 

Other disaster relief teams, like the National Disaster Medical System (NDMS), focus on medical response, providing emergency medical care, moving patients to unaffected areas, and offering definitive care at hospitals. 

The Disaster Medical Assistance Team (DMAT) and the National Medical Response Team (NMRT) specialize in mass decontamination and medical care for victims of weapons of mass destruction or hazardous material incidents. 

The Community Emergency Response Team (CERT) Program educates communities about disaster preparedness and trains them in basic disaster response skills, such as fire safety, light search and rescue, and team organization. 

Overall, disaster relief teams provide a vital lifeline to communities in need, offering immediate assistance, medical care, and the tools and knowledge necessary for long-term recovery and resilience.",False,1.0,0.88
9,10,msmarco,multi,standard measurement of an acre squared,"An acre is a unit of measurement used to describe the area of a piece of land. It is commonly used in the United States and is equal to 43,560 square feet. 

When we talk about an ""acre squared,"" we are referring to the square of the area, which is calculated by multiplying an acre (as a unit of area) by itself. In this context, ""acre squared"" represents an area of 1 acre multiplied by another 1 acre, resulting in a new unit of measurement for a larger area. 

However, it's important to note that ""acre squared"" is not a standard unit of measurement. The standard unit for land area in the United States is simply ""acre,"" and measurements are typically given in acres, with 1 acre equal to 43,560 square feet.",True,0.0,0.5833333333
10,11,msmarco,multi,how long is gestation in bearded dragons,"The gestation period for bearded dragons is typically between 4 to 6 weeks, or about 30 to 45 days.",True,1.0,0.5
11,12,msmarco,multi,actual cost of cremation,"The cost of cremation varies depending on location and the type of service provider. On average, the cost of cremation through a funeral home is between $2,000 and $4,000, while the average cost of cremation through a crematory is between $1,500 and $3,000. These prices typically include the cremation and a basic memorial service. 

However, the simple act of cremating a body can cost as little as $500 and go up to $2,000, depending on the region. 

It's important to note that these are just estimates, and the actual cost of cremation can vary depending on various factors, such as the type of container or casket chosen, the disposition of the ashes, and any additional services requested.",True,1.0,1.0
12,13,msmarco,multi,what does isp do,"An Internet Service Provider (ISP) is a company that provides its customers with access to the internet and other related services. ISPs maintain a direct connection to the internet and often offer additional features such as web hosting, data center services, and email solutions. They act as a gateway to the internet, enabling users to send emails, shop online, conduct research, and access various online content and services. ISPs offer different plans and deals to cater to diverse user needs. Some examples of ISPs include AOL, Virgin, BT, TalkTalk, Comcast, Sprint, and CenturyLink, among others.",True,1.0,1.0
13,14,msmarco,multi,what is an internal medicine specialist,"An internal medicine specialist, also known as an internist, is a physician who specializes in the medical care of adults, including the prevention, diagnosis, and treatment of a wide range of conditions affecting the internal organs and the body as a whole. Internists may work in hospitals, outpatient clinics, or have their own office-based practices, often with links to local hospitals. They can be generalists or subspecialize in areas such as cardiology, nephrology, immunology, and endocrinology.",True,1.0,1.0
14,15,msmarco,multi,startup cost for lularoe,"The startup cost for LuLaRoe is estimated to be around $3,000 to $4,000 for inventory, depending on the line selections.",True,1.0,1.0
15,16,msmarco,multi,what does medical practitioner mean,"A medical practitioner is a doctor or other healthcare professional who provides medical care and treatment to patients. They can work in a variety of settings, including hospitals, clinics, and private practices, and may specialize in different areas of medicine. Some medical practitioners may also conduct medical research or teach at medical schools. In some contexts, a medical practitioner may also be referred to as a ""clinician."" The specific definition of a medical practitioner can vary slightly depending on the region and the specific regulations governing medical practice.",False,0.6000000000000001,0.5833333333
16,17,msmarco,multi,what is a muslim jurisdiction,"A Muslim jurisdiction refers to a legal system where Islamic law, known as Shariah, is applied. It governs the behavior of Muslim individuals and their relationships with themselves, their families, communities, and the wider Muslim community (Ummah). In countries like Saudi Arabia, Kuwait, and Yemen, where Islam is the official religion, Sharia is declared as the source of law, and the governments derive their legitimacy from it. Muslim jurisdictions have exclusive authority over Muslims and their boundaries are typically limited to respective states.",False,1.0,0.8333333333
17,18,msmarco,multi,hip conditions that cause back pain,"There are several hip conditions that have been known to cause back pain. These include: 

- Hip Osteoarthritis: A breakdown of cartilage in the hip joint that can lead to back, hip, and leg pain. This condition is often associated with arthritis in the back, which can make it challenging to pinpoint the exact source of pain. 

- Hip Fractures: Sudden injuries or fractures in the hip region can lead to unexpected hip pain that may radiate to the back. This is more common in older individuals who are more prone to falls and have weaker bones. 

- Soft Tissue Problems: Issues with the muscles, ligaments, tendons, and other soft tissues surrounding the hip joint can cause pain on the outside of the hip, upper thigh, or outer buttock. This pain may refer to the back or spine, creating a sensation of back pain. 

- Bursitis: Inflammation of the bursae (fluid-filled sacs that act as cushions between bones and tissues) in the hip can lead to hip and back pain, especially during movement or activity. 

- Lower Back Conditions: While not directly a hip condition, issues in the lower back, such as disc problems, facet joint issues, sacroiliac joint dysfunction, or nerve compression, can radiate pain to the hip and surrounding areas. 

It is important to consult with a healthcare professional for an accurate diagnosis and treatment plan if you are experiencing hip or back pain, as the causes can vary and may require different approaches for management.",False,0.8,0.7368421053
18,19,msmarco,multi,How does discrimination affect work,"Discrimination in the workplace can have a range of negative effects on both employees and the business as a whole. 

For employees, discrimination can lead to a loss of job satisfaction, motivation, and interest in their work. They may become demoralized, develop a bad attitude, and reconsider the value of their job. This can result in increased employee turnover as people choose to leave discriminatory work environments. 

Discrimination also affects the entire workforce, creating a poor work culture with a demoralized, mistrustful, and discontented atmosphere. It can lead to a loss of focus and productivity, as time is wasted dealing with the fallout of discriminatory incidents and attempting to address them in meetings. 

Additionally, discrimination harms the business's reputation in the community and may deter potential clients and recruits. It can also result in costly legal settlements, as seen in cases involving large corporations. 

Overall, discrimination has far-reaching consequences that impact all aspects of a business and the people involved.",False,1.0,1.0
19,20,msmarco,multi,what was mouthwash originally used for,Mouthwash was originally used as a surgical antiseptic and to disinfect wounds.,False,1.0,0.5
20,21,msmarco,multi,what happens when a homeless felon person dies,"When a homeless person dies, there are a few possible outcomes. If the person has no known family or next of kin, their body is usually taken to a morgue, where a report is made to the registrar of the Bureau of Vital Statistics. The county coroner may also be involved if the person did not die of natural causes or if there is suspicion of foul play. 

In some cases, homeless individuals who die in hospitals may be buried in mass graves, especially if they have no family to claim their bodies. Their bodies may be cremated, and the remains scattered at sea. 

If the homeless person has family or next of kin, that family will decide what to do with the body, whether it be burial, cremation, or another option. 

It is important to note that regardless of a person's social or economic status, funeral home directors and those involved in the process aim to treat the deceased with dignity and respect.",True,0.0,0.7692307692
21,22,msmarco,multi,what is a normal creatinine level,"A normal level of creatinine in the blood for adult males falls between 0.6 to 1.2 milligrams (mg) per deciliter (dl), while for adult females, it is between 0.5 to 1.1 mg/dL. These values can vary slightly between different labs. It's important to note that normal creatinine levels depend on an individual's muscle mass, with men typically having higher levels than women due to greater muscle mass.",True,1.0,1.0
22,23,msmarco,multi,what is congressional oversight,"Congressional oversight is the review, monitoring, and supervision of the Executive Branch and its federal agencies, programs, activities, and policy implementation by the United States Congress. It is an integral part of the system of checks and balances in the American government, derived from the Constitution, public laws, and House and Senate rules. Congress primarily exercises this oversight function through its committee system, holding hearings and investigations to ensure executive officials are accountable for their actions and the implementation of delegated authority.",True,1.0,1.0
23,24,msmarco,multi,what are amines,"Amines are organic compounds that contain one or more atoms of nitrogen and are often derivatives or relatives of ammonia. In amines, one or more of the hydrogen atoms in ammonia are replaced by an organic functional group, such as an alkyl or aryl group. This replacement results in different types of amines, including primary, secondary, and tertiary amines, depending on the number of hydrogen atoms substituted. Amines generally have single bonds between carbon and nitrogen atoms and are typically weak bases.",True,1.0,1.0
24,25,msmarco,multi,can itunes be set up on kindle,"Yes, you can set up iTunes on your Kindle Fire and play your purchased iTunes music. If your iTunes purchases are backed up to iCloud, you can use the Amazon Cloud Player to access your music. You can also use a DRM removal tool to remove DRM protection from iTunes music and videos and then transfer the non-DRM files to your Kindle Fire for playback. Additionally, you can buy music from the Amazon MP3 store and use the Amazon MP3 Downloader to automatically send the music to iTunes on your computer.",True,0.0,0.8571428571
25,26,msmarco,multi,driving time barcelona to madrid,The driving time from Barcelona to Madrid is approximately 6 hours.,True,1.0,1.0
26,27,msmarco,multi,how much chicken cutlets per person,"For boneless chicken cutlets, it is recommended to plan for 4-5 ounces of cooked chicken per person, which translates to about 5-6 ounces of raw chicken per person. Some sources suggest that 8 ounces of raw boneless chicken per person is a more generous portion, especially if chicken is the main course. 

If you are serving bone-in chicken cutlets, it is recommended to buy about 8 ounces of raw chicken per person, which will yield about 4-5 ounces of meat per serving. 

These recommendations are based on the assumption that chicken is the main course and that people will be eating other foods alongside the chicken. Adjustments may be necessary depending on the overall menu and the appetite of your guests.",False,1.0,0.7000000000000001
27,28,msmarco,multi,what is arabic gum,"Arabic gum, also known as gum Arabic, gum acacia, E414, chaar gund, char goond, or meska, is a natural gum made from the hardened sap of the Acacia tree, specifically the species Senegalia (Acacia) senegal and Vachellia (Acacia) seyal. It is a complex mixture of glycoproteins and polysaccharides and is used in a variety of applications, primarily as a stabilizer, emulsifier, and thickening agent in the food and drink industries. It is commonly used in soft drinks, confectionery, chewing gum, and traditional desserts. Outside of the food industry, Arabic gum is used in the manufacture of inks, adhesives, and pharmaceuticals.",True,1.0,1.0
28,29,msmarco,multi,increasing doses of neurontin,"The dosage of Neurontin (gabapentin) can be increased depending on the condition being treated and the patient's response. For adults with epilepsy, the recommended initial dosage is 300 mg taken once to three times a day, with a usual maintenance dose of 900 mg per day given in three divided doses. If needed, the maintenance dose can be increased up to a maximum daily dose of 1,800 mg. 

For adults with postherpetic neuralgia, Neurontin therapy is typically initiated with a lower starting dose of 300 mg on Day 1, increased to 600 mg/day (300 mg two times a day) on Day 2, and then to the recommended maintenance dose of 900 mg/day (300 mg three times a day) on Day 3. 

It is important to note that the maximum time between doses should not exceed 12 hours for both conditions, and Neurontin should be administered three times a day. Additionally, the bioavailability of gabapentin decreases as the dose is increased, so this should be considered when adjusting the dosage. 

Please consult a medical professional for personalized advice and always follow their recommendations for dosage adjustments.",True,1.0,0.7857142857
29,30,msmarco,multi,how much does it cost to put in a shower in a bathroom,"The cost of installing a new shower in a bathroom can vary depending on several factors, including the type of shower, the materials used, the complexity of the installation, and your location. 

For a very basic shower enclosure, you could pay as little as $400 to $600. However, if you want a more elaborate setup, such as a combination bath/shower unit or a top-of-the-line surround, the price could range from $1,500 to $3,000 or more. 

If you're considering a tile shower, the cost will likely start at around $1,500 and can increase to $5,000 or higher, depending on the design and any additional features you choose. 

The cost of tiling a shower typically ranges from $744 to $1,006, but again, this can vary depending on the type of tile and the size of the shower. 

According to one source, the national average for a new shower installation project by a professional contractor is $2,689. 

Keep in mind that these are general estimates, and the actual cost for your specific project may differ. It's always a good idea to get quotes from multiple contractors and to discuss the specific details of your project to get a more accurate estimate.",True,1.0,0.8571428571
30,31,msmarco,multi,why the reactions of the calvin cycle are also referred to as light independent reactions,"The reactions of the Calvin cycle are referred to as light-independent reactions because they do not require light directly for any of their steps. Instead, the Calvin cycle uses products of the light-dependent reactions, such as ATP and NADPH, to fix carbon dioxide into carbohydrates like glucose. This process occurs in the stroma of plant chloroplasts, where sugars are synthesized from carbon dioxide.",True,1.0,1.0
31,32,msmarco,multi,vanna white income,Vanna White's annual salary as the hostess of *Wheel of Fortune* is estimated to be around $4 million per year. Her net worth is estimated to be between $15 million and $30 million.,False,1.0,1.0
32,33,msmarco,multi,what is calcium chloride used for medically,"Calcium chloride is used in medicine as a source of calcium, often to replenish calcium levels in the blood, and as a diuretic. It is prescribed for the treatment of hypocalcemic tetany and as an antidote for lead or magnesium poisoning, or magnesium sulfate overdose. Calcium chloride is also used in cardiac resuscitation and as a treatment adjunct in cardiac arrest.",False,0.8,0.8888888889000001
33,34,msmarco,multi,deductible investment management fees for iras,"Investment management fees for IRAs (Individual Retirement Accounts) are deductible and can be paid directly from the IRA itself or with outside funds. Paying these fees directly from an IRA reduces the reportable distribution, and thus taxable income, from the account. Using outside funds to pay the fees may provide a tax deduction, but the advantage is typically minimal compared to using pretax dollars from the IRA. It is important to note that only the management fee itself is deductible; any other expenses associated with the account may not be deductible in the same way.",False,1.0,0.7777777778
34,35,msmarco,multi,what is the riparian brush rabbit common and species name,"The common name of the species is the riparian brush rabbit, and its species name is Sylvilagus bachmani riparius.",True,1.0,1.0
35,36,msmarco,multi,what is the delivery time for priority mail express,"The delivery time for Priority Mail Express is guaranteed to be overnight or within 1 to 2 days, including Sundays and holidays. The specific delivery time depends on the destination and the distance from the original package location. Hold for Pickup items are available for claim by the addressee at the destination facility by 10:30 a.m. or 3 p.m. of the next day. An optional fee is charged for a 10:30 a.m. delivery request.",True,1.0,0.7777777778
36,37,msmarco,multi,which molecule is butane,"Butane, also known as n-butane, is the unbranched alkane with the chemical formula C4H10. It has four carbon atoms and ten hydrogen atoms, forming a straight-line structure. Butane is sometimes used as a collective term for n-butane and its isomer, isobutane (or methylpropane).",False,1.0,1.0
37,38,msmarco,multi,what are the beryllium halides,"Beryllium halides include compounds such as beryllium fluoride (BeF2) and beryllium chloride (BeCl2). These compounds are largely covalent in nature, with beryllium fluoride being considered predominantly ionic.",False,0.8,1.0
38,39,msmarco,multi,what are the different parts of a volcano called,"The different parts of a volcano are called: 
- Magma Chamber: A large pool of molten rock (magma) beneath the Earth's crust. 
- Vent or Throat: An opening in the Earth's surface through which lava, ash, and gases escape. 
- Flank: The side of a volcano. 
- Parasitic Cone: A small, cone-shaped volcano formed by volcanic debris. 
- Sill: A flat piece of rock formed when magma hardens in a crack in the volcano. 
- Cone or Crater: The accumulation of lava, cinders, ash, and other materials that build up around the vent, giving the volcano its characteristic shape. 
- Lava: Magma that has reached the Earth's surface and cooled down. 

These are the main parts of a volcano, each serving a specific function and contributing to the overall structure and behavior of volcanic eruptions.",False,0.8,0.4545454545
39,40,msmarco,multi,what is eris,"Eris is a dwarf planet located in the outer reaches of our solar system. It was discovered in 2005 by a team of astronomers led by Mike Brown and is considered the most massive and second-largest dwarf planet known in the solar system. Eris is a trans-Neptunian object (TNO) and a member of a high-eccentricity population known as the scattered disk. It is about 2,326 kilometers in diameter, making it slightly larger than Pluto, and has a mass that is approximately 0.27% of the Earth's mass. The discovery of Eris played a significant role in the reclassification of Pluto as a dwarf planet.",True,0.8,0.9166666667000001
