,record_no,source,doc_type,question,response,score,cp_score,ragas_score
70,71,msmarco,multi,define formal organization,"A formal organization is a deliberate structure with defined rules, policies, and procedures, aimed at achieving specific goals. It is characterized by a division of labor, clear functions, and a hierarchy of power and authority. Formal organizations are governed by stated norms and often consist of interrelated groups or subsystems. An organizational chart, or structure chart, is a visual representation of a formal organization, showing the hierarchy and interrelationships between different positions and departments. Examples of formal organizations include churches, schools, hospitals, and companies.",True,1.0,0.8666666667
71,72,msmarco,multi,do i need a prescription for oxygen,"Yes, you do need a prescription for oxygen. In the United States, supplemental oxygen is classified as a prescription medication. A valid prescription for oxygen should include specifics such as the duration of oxygen use, flow rate, delivery device (nasal cannula or oxygen mask), and the type of oxygen system (concentrator, compressed gas tank, or liquid oxygen). It's important to consult with a knowledgeable doctor to obtain a prescription that meets your individual needs.",True,1.0,1.0
72,73,msmarco,multi,what genre did william wordsworth wrote in,"William Wordsworth was a Romantic poet and is often credited with being the pioneer of the Romantic movement in English literature. He is known for his nature-inspired poetry and use of colloquial language, departing from the more formal and stylized poetry of the time. His work often explored the connection between the natural world and human emotions, a key tenet of Romanticism.",True,1.0,1.0
73,74,msmarco,multi,average salary for a probation officer,"The average salary for a probation officer in the United States is around $50,000 per year, but this can vary depending on factors such as experience, location, and employer. For example, probation officers with less than a year of experience may earn between $24,666 and $48,479, while those with 10-19 years of experience can earn up to $79,983. Probation officers in certain states, such as California, Texas, and Florida, tend to have higher wages, and those working in urban areas may also earn higher salaries. Additionally, probation officers employed by local government agencies tend to earn slightly more than those working for state government.",False,1.0,1.0
74,75,msmarco,multi,why are muscles important,"Muscles are important for several reasons. Firstly, they enable us to move by converting energy into motion, allowing us to perform various physical activities such as running, dancing, and building. 

Secondly, muscles provide stability and protection to our bodies, especially the core muscles surrounding the spine and pelvis, which help prevent injuries to the back and civilian joint. 

Additionally, muscles are crucial for internal functions, such as controlling the pumping of the heart. 

Moreover, muscles require proper recovery and stretching to maintain their health and prevent injury. Stretching helps lengthen and open up the muscles, improving flexibility and range of motion in the joints.",True,1.0,1.0
75,76,msmarco,multi,what company makes dubble bubble,Dubble Bubble was created by Fleer Candy Company accountant Walter Diemer in 1928 and joined the Tootsie Roll Industries family in 2003.,True,1.0,1.0
76,77,msmarco,multi,asparagus health benefits and side effects,"Asparagus has a wide range of health benefits and is considered a nutrient-rich food. Here are some key benefits: 

- Nutrient Dense: Asparagus is loaded with vitamins and minerals, including vitamins A, C, E, K, and folate, as well as chromium and fiber. 
- Heart-Healthy: It contains no fat, cholesterol, or sodium, making it a good choice for a heart-healthy diet. 
- Fertility and PMS Relief: Asparagus is believed to provide relief from pre-menstrual syndrome and may have positive effects on fertility. 
- Preventing Kidney and Bladder Stones: Asparagus may help prevent stones in the kidney and bladder. 
- Fighting Anemia: Due to its high folic acid content, asparagus can help prevent anemia caused by folic acid deficiency. 
- Treating Skin Issues: Some people use asparagus topically to treat acne, dry sores, and clean the skin. 
- Reducing Urinary Tract Infections: Asparagus is said to reduce the risk of urinary tract infections. 
- Lowering Cholesterol: It may help lower blood cholesterol levels. 

While asparagus is generally safe and packed with benefits, there are a few side effects to be aware of: 

- Allergic Reactions: Some people may be allergic to asparagus, especially if they are allergic to other members of the lily family like onions, garlic, or chives. Allergic reactions can include a runny nose, hives, trouble breathing, and swelling around the mouth and lips. 
- Gas and Odor: Eating large amounts of asparagus may cause gas and a noticeable smell in urine due to sulfuric compounds. However, this is not harmful and few people can actually detect the smell. 
- Unsafe During Pregnancy in Medicinal Amounts: While safe in food amounts, asparagus in large medicinal amounts is considered unsafe during pregnancy as it may affect hormone balances. 

Remember, asparagus is generally a very healthy addition to your diet, but as with anything, moderation is key to avoiding any negative side effects.",True,0.8,1.0
77,78,msmarco,multi,ITIL wiki definition,"ITIL, short for IT Infrastructure Library, is a set of widely accepted practices for IT Service Management (ITSM). It provides a collection of concepts, processes, and procedures that can be applied by organizations to align their IT services with business needs, deliver value, and maintain competency. ITIL offers a cohesive set of best practices and is supported by qualifications, accredited training, and implementation tools. The ITIL glossary provides definitions and acronyms related to ITIL and ITSM, helping users understand the specialized terms used in the framework.",True,1.0,1.0
78,79,msmarco,multi,what is hippocampus,"The hippocampus is a small, curved, elongated region of the brain that is part of the limbic system and is involved in forming, storing, and processing memories. It is located in the medial temporal lobe of the brain, underneath the cortical surface, and exists in pairs, with one hippocampus in each brain hemisphere. The hippocampus is particularly important for long-term memory and spatial navigation.",True,1.0,1.0
79,80,msmarco,multi,what are the rings around our moon called,"The ring-like optical phenomenon that occasionally appears around the moon is called a moon halo, lunar halo, or moon ring. This occurs when tiny ice crystals in the atmosphere refract and reflect moonlight (which is reflected sunlight) creating a halo with a radius of about 22 degrees around the moon.",True,1.0,1.0
80,81,msmarco,multi,uzma name meaning,"The name Uzma has multiple origins and meanings. In Muslim and African culture, Uzma means ""greatest."" In Spanish, the name means ""a capable woman."" The name is typically given to girls and is not commonly used. Variations of the name include Usma, Usmah, and Uzmah.",True,1.0,1.0
81,82,msmarco,multi,what do gmos cause,"GMOs, or genetically modified organisms, can cause harm to the environment, particularly to birds, insects, amphibians, marine ecosystems, and soil organisms. They can also lead to a reduction in biodiversity, water pollution, and unsustainability.",True,0.6000000000000001,1.0
82,83,msmarco,multi,what manu means in maori,"In the Māori language, 'manu' means bird or kite. The Māori kite is known as 'manu tukutuku' or 'manu aute', with 'manu' meaning kite or bird, and 'tukutuku' referring to the winding out of the line as the kite ascends.",True,1.0,1.0
83,84,msmarco,multi,what triggers dissociative disorder,"Dissociative disorders are usually triggered by trauma, especially in children who have experienced long-term physical, sexual, or emotional abuse. Less commonly, they can also develop in unpredictable or frightening home environments, or as a result of natural disasters or combat experiences. These events can cause a person to dissociate, or disconnect from their thoughts, identity, consciousness, and memory, as a way to cope with the trauma they've experienced.",True,1.0,1.0
84,85,msmarco,multi,what is chemical sedimentary composed of,"Chemical sedimentary rocks are composed of mineral crystals that have been dissolved out of water and then precipitated out of the solution, often at the base of a water body. These rocks are not made up of weathered sediment grains but instead contain crystals and other elements that came from water.",True,1.0,1.0
85,86,msmarco,multi,do vinegar baths work for sunburn,"Yes, vinegar baths can be effective in treating sunburns and providing relief from symptoms such as burning, peeling, and pain. To create a vinegar bath for sunburn treatment, add two cups of apple cider vinegar or white vinegar to a bathtub of lukewarm water and soak in it for 15 to 20 minutes. Repeat this process 2 to 3 times daily until sunburn symptoms improve. 

It is important to note that vinegar should not be sprayed or applied directly to the face and should be kept away from the eyes, as it can cause burning. If you experience fever, blisters, or chills after sunburn, seek medical attention immediately. Additionally, do not use vinegar for sunburn if there is blistering, as this indicates a second-degree sunburn that requires treatment with antibiotic creams.",True,1.0,0.9333333333
86,87,msmarco,multi,name that means kind,"There are several names that mean ""kind,"" including: 
- Dayakar
- Esmun 
- Atuf
- Benicio
- Ellis 
- Cade 
- Ellis 
- Alicio 
- Narkissos/Narcissus
- Al-Karim 
- Bujar

Some names with similar meanings include: 
- Fazli, meaning ""kind.""
- Chiron, meaning ""kind one.""
- Cedric, meaning ""kind and loved.""
- Francis, meaning ""free man"" or ""Frenchman,"" also suggesting kindness and nobility. 

These names have been popular for boys, especially in the 1930s-1960s, with a resurgence in recent years for some, like Ellis and Cade.",False,0.0,0.5
87,88,msmarco,multi,average time for digestion in humans,"The average time for food to be fully digested in humans ranges from 24 to 72 hours, with some sources stating it can take up to 48 or even 72 hours in certain cases. This process includes the time it takes for food to pass through the stomach, small intestine, and large intestine (colon). The time it takes for food to pass through the gut alone is estimated to be between 24 and 56 hours. 

It's important to note that digestion times can vary based on various factors such as gender, age, exercise habits, and the type of food consumed.",False,1.0,1.0
88,89,msmarco,multi,starch also known as,"Starch, also known as cornstarch or corn flour, is a fine, powdery substance derived from corn. It has a variety of uses in baking and cooking, often used as a thickening agent.",False,0.4,0.4
89,90,msmarco,multi,how long does it take irs to cash your check,"The IRS processes check payments electronically upon receipt, and the amount is typically debited from your account within 2 minutes of the payment envelope being opened at the IRS Service Center. If it takes a couple of days for your return to reach the Service Center, you can expect the check to clear within 2-3 days of mailing your return.",False,1.0,1.0
90,91,msmarco,multi,average temperature in bali,"The average annual temperature in Bali, Indonesia is 28.1°C (82.6°F). However, the average temperature varies slightly throughout the year, with May being the hottest month at 28°C (82°F) and January being the coldest at 26°C (79°F). November is the hottest month in terms of average high temperatures, reaching 90°F, while July is the coolest month in terms of average low temperatures, dipping to 75°F.",False,0.8,1.0
91,92,msmarco,multi,what is cpcu designation,"The CPCU (Chartered Property Casualty Underwriter) designation is a credential for insurance professionals who complete a rigorous program of study, including four foundation courses, one elective, three personal or commercial insurance courses, and eight national exams. It equips holders to meet the challenges of a demanding risk management and insurance marketplace with confidence and professionalism.",True,1.0,1.0
92,93,msmarco,multi,what are the pelvic organs,"The pelvic organs include the bladder, rectum, and, in females, the uterus, vagina, ovaries, and fallopian tubes. In males, the pelvic cavity contains the bladder and rectum.",True,0.8,1.0
93,94,msmarco,multi,how to make a large first letter in word,"To make a large first letter in Microsoft Word, follow these steps: 

1. Type the first word, sentence, or paragraph of your document or section. 
2. Click anywhere in the paragraph after the first letter you want to enlarge. Ensure you don't click at the beginning of the paragraph, or the Drop Cap feature won't be available. 
3. Go to the ""Insert"" tab and click on the ""Add a Drop Cap"" menu in the Text section. 
4. Choose the type of drop cap you want, such as ""Dropped"" or ""In the Margin."" 

This will create a large dropped initial capital letter, also known as a ""dropped cap,"" which is commonly used to start a document, chapter, newsletter, or invitation.",False,1.0,1.0
94,95,msmarco,multi,is glen campbell alive,"No, Glen Campbell is not alive. The country music singer passed away in 2017 at the age of 81, six years after being diagnosed with Alzheimer's disease. He was known for his music career spanning five decades, with hits such as ""Rhinestone Cowboy"" and ""By the Time I Get to Phoenix.""",True,0.0,0.2
95,96,msmarco,multi,does daryl dixon die in the comic books,"No, Daryl Dixon does not die in the comic books because the character does not exist in that medium. Norman Reedus' character Daryl Dixon was created specifically for the TV show adaptation of ""The Walking Dead.""",True,1.0,1.0
96,97,msmarco,multi,where on the map is jamaica island,"Jamaica is an island nation located in the Caribbean Sea, specifically in the northwestern region of the sea as part of the Greater Antilles. It is situated about 145 kilometers (90 miles) south of Cuba and 191 kilometers (119 miles) west of the island of Hispaniola, which includes the countries of Haiti and the Dominican Republic. Jamaica is the fifth-largest island country in the Caribbean and covers an area of approximately 10,990 square kilometers (4,240 square miles). The island stretches about 235 kilometers (146 miles) from east to west and expands to 82 kilometers (51 miles) at its widest point. Kingston, the capital and largest city of Jamaica, is located on the south coast of the island.",True,1.0,0.9230769231
97,98,msmarco,multi,what is lemon curd,"Lemon curd is a thick, creamy, and rich spread or filling, often associated with Great Britain, where it has traditionally accompanied tea since the 18th century. It is made by cooking together lemon juice, eggs, and sugar. Some recipes also include butter, lemon zest, or whipped cream for extra richness and a silky mouthfeel. The simple ingredients are cooked until they thicken, resulting in a texture similar to custard or lemon meringue pie filling. Lemon curd can be used in a variety of ways, such as spread on scones, crepes, or toasted English muffins.",True,1.0,1.0
98,99,msmarco,multi,the scientific name of the sea snail,"The scientific name of the Cerith Snail, a sea snail, is Cerithidae genus. This genus originates from the Caribbean Sea and the Eastern Pacific Ocean, including the waters off Mexico and Baja California. These sea snails can grow up to a size of around one inch.",True,1.0,1.0
99,100,msmarco,multi,great barrier reef average temperatures,"The Great Barrier Reef experiences a tropical climate, with average summer temperatures between 24°C and 33°C, and winter temperatures ranging from 14°C to 26°C. The average maximum temperature is 30°C, and the average minimum is 21°C. The Tropical North region of the reef sees an average rainfall of 2010mm, with an average of 168mm per month.",True,1.0,1.0
100,101,msmarco,multi,how fast does magnolia grandiflora grow,"The growth rate of Magnolia grandiflora, or Southern magnolia, varies depending on the cultivar and growing conditions. On average, Southern magnolias grow between 1 to 2 feet per year and are considered to have a slow-to-medium rate of growth. However, certain cultivars like ""Samuel Sommer"" and ""Claudia Wannamaker"" are known for their fast-growing capabilities, reaching heights of 30 to 40 feet tall.",True,1.0,1.0
101,102,msmarco,multi,when were the jeffersons on,"The Jeffersons was broadcast on CBS from January 18, 1975, to June 25, 1985 (some sources state that the final episode aired on July 2, 1985). The show aired for 11 seasons and a total of 253 episodes.",True,1.0,0.75
102,103,msmarco,multi,headliner repair cost,"The cost of repairing a car headliner varies depending on several factors, including the extent of the damage, your location, and whether you choose to do it yourself or hire a professional. 

If you decide to repair the headliner yourself, the cost will mainly depend on the materials needed. A headliner replacement kit can cost around $50 to $95, and the foam-backed headliner material typically costs $10 to $20 per yard. You may also need additional tools and adhesives, which can add to the total cost. 

On the other hand, hiring a professional service to repair your car headliner can cost anywhere from $200 to $2000 or more, depending on the type of vehicle and the service provider. Local auto repair shops typically charge between $200 and $350, while auto dealers may charge higher prices, ranging from $650 to $850. Boat dealers and aircraft shops have even wider price ranges, from $350 to $1650 and $600 to $2000 per yard, respectively. 

It's important to note that these prices are averages, and the actual cost may differ based on your specific situation and the condition of your car headliner.",True,1.0,0.9473684211000001
103,104,msmarco,multi,what is protein downstream processing,"Downstream processing is a crucial step in the manufacturing process of various pharmaceuticals and biological products, including proteins. It involves the recovery, purification, and preparation of these products for their intended use, ensuring they meet the required quality standards and are safe for their intended application. 

In the context of protein purification, downstream processing specifically refers to the series of steps taken to isolate and purify a protein product, often obtained from natural sources or through recombinant technology, to a level suitable for its intended use, such as therapeutic applications. This process typically includes multiple chromatography steps, along with other techniques like solubilization, refolding, precipitation, and sterile filtration, to remove impurities and contaminants while retaining the structural integrity and functionality of the protein. 

The overall goal of downstream processing is to produce a purified protein that meets regulatory guidelines and is safe and effective for its intended purpose, whether it be for therapeutic use, diagnostics, industrial applications, or other specialized functions. It is a critical field that ensures the reliability and consistency of protein-based products across various industries.",True,1.0,0.8518518519
104,105,msmarco,multi,what is the generic name for cialis,The generic name for Cialis is tadalafil.,True,0.4,0.0
105,106,msmarco,multi,do you cite everything in a research paper,"Yes, in a research paper, you must cite every piece of information that you have obtained from external sources. This includes facts, data, opinions, and ideas that are not your own original thoughts. The specific format of the citations may vary depending on the style guide you are using (such as MLA, APA, or Chicago style), but the fundamental principle of acknowledging your sources remains consistent. 

Here are some key points to consider regarding citations in a research paper:

1. In-text Citations: Whenever you directly quote, paraphrase, or summarize someone else's work, include an in-text citation. This typically involves mentioning the author's last name and the publication year, or, in the case of MLA style, the author's name and the page number. 
2. Signal Phrases: You can introduce your citations with signal phrases that mention the author's name. For example, ""According to Smith (2010), the experiment yielded intriguing results.""
3. Works Cited or Reference List: At the end of your paper, provide a detailed list of all the sources you have cited. This could be called a ""Works Cited"" page in MLA format or a ""Reference"" list in APA or Chicago style. 
4. Secondary Sources: If you are using information from a source that is citing another source, make sure to cite the original source as well. 
5. Page or Paragraph Numbers: In certain styles, like MLA, you are required to include page or paragraph numbers for direct quotations. However, this is not necessary if you are simply referring to general information from a source. 
6. Common Knowledge: You don't need to cite widely known facts or common knowledge. Use your judgment to determine if the information is readily available in multiple sources and is widely accepted as true. 

Remember, proper citation is crucial for academic integrity and gives credit to the scholars, researchers, and authors whose work has contributed to your own. By citing your sources accurately, you not only avoid plagiarism but also provide valuable guidance to readers who may want to explore your references further.",True,1.0,0.4615384615
106,107,msmarco,multi,how much does it cost to spayed my female rabbit,"The cost of spaying a female rabbit can vary depending on your location and the individual vet or clinic. In general, prices can range from as low as $50 to several hundred dollars. On average, you can expect to pay around $100 to $200 for the procedure, with some vets charging up to $300 or more in major metropolitan areas. It is recommended to consult with a rabbit-knowledgeable vet, as rabbits require a different type of anesthesia than dogs and cats. Additionally, there may be additional costs for medications and follow-up visits.",False,1.0,0.8888888889000001
107,108,msmarco,multi,name meaning etna,"The name Etna has multiple meanings and origins. 

In the context of a volcano in Sicily, Italy, and a river in Norway, Etna likely refers to Mount Etna, an active volcano in Sicily that is the highest in Europe. 

As a girl's name, Etna has Irish and Gaelic roots, meaning ""kernel."" It is a variant of the name Eithne. In this context, Etna was most popular as a baby name in 1902, ranking 914th. 

Etna can also refer to a device used for heating liquids, consisting of a cup fixed in a saucer where alcohol is burned. This usage of the word likely originates from Mount Etna in Sicily due to its cone shape. 

Finally, Aetna is a well-known brand name for a group of subsidiary companies providing healthcare and insurance-related products and services.",True,0.4,0.8235294118
108,109,msmarco,multi,what is benaka use for,"Benaka Healthcare is a supplier, trader, exporter, and importer of medical equipment, established in 2009. They provide medical equipment such as medical scanner machines, X-ray machines, and digital X-ray systems.",False,1.0,1.0
109,110,msmarco,multi,define what a single gene defect is,"A single gene defect, also known as a single-gene disorder or Mendelian trait, is a disease or condition caused by a mutation in a single gene located on a chromosome. This mutation leads to an altered sequence of nucleotides in the DNA, which can affect a single nucleotide pair or larger segments of a chromosome. As a result, the amino acid sequence in the proteins coded by this section of DNA is changed, potentially leading to various genetic disorders. Most inherited single gene defects are recessive, requiring an individual to inherit two copies of the mutated gene to express the disorder.",True,1.0,0.875
110,111,msmarco,multi,what is mes,"MES stands for Manufacturing Execution System. It is a comprehensive control system that manages and monitors the activities and operations on a factory floor or shop floor. MES software tracks and documents the transformation of raw materials into finished goods, providing real-time data and insights to improve productivity, reduce costs, and optimize production output. The main goal of MES is to achieve and maintain high performance in a competitive and dynamic manufacturing environment.",True,1.0,0.7777777778
111,112,msmarco,multi,how far is disneyland from universal studios,"Disneyland is located in Anaheim, while Universal Studios is about 40 miles north in Universal City. The driving distance between the two places is approximately 30 minutes to over 3 hours, depending on traffic conditions.",True,1.0,1.0
